<?xml version="1.0" encoding="UTF-8"?>
<!--
 * ***********************************************************************************************
 *
 * Phoebius Framework
 *
 * **********************************************************************************************
 *
 * Copyright (c) 2009 phoebius.org
 *
 * All rights reserved.
 *
 *************************************************************************************************
-->

<!DOCTYPE index SYSTEM "../../dtd/index.dtd">

<index site-part="Support">
	<doc xml="/support/support.xml" location="/support/">
		<include xml="support/index.xml" prefix="support"/>
	</doc>
	<doc xml="highlights.xml"></doc>
	<doc xml="roadmap.xml"></doc>
	<doc xml="about.xml" site-part="About"></doc>
	<doc xml="download.xml" site-part="Download"></doc>
	<doc xml="sitemap.xml"></doc>
</index>