<?xml version="1.0" encoding="UTF-8"?>
<!--
 * ***********************************************************************************************
 *
 * Phoebius Framework
 *
 * **********************************************************************************************
 *
 * Copyright (c) 2009 Scand Ltd.
 *
 * All rights reserved.
 *
 *************************************************************************************************
-->

<!DOCTYPE index SYSTEM "../../../../dtd/index.dtd">

<index>
 <doc xml="manual.xml" location=""/>
 <doc xml="basics.xml"/>
 <doc xml="configuration.xml"/>
 <doc xml="application.xml"/>
 <doc xml="model.xml"/>
 <doc xml="codegen.xml"/>
<!-- <doc xml="querying-entities.xml"/>
 <doc xml="routers.xml"/>
 <doc xml="controllers.xml"/>
 <doc xml="presentation-logic.xml"/>
 -->
	<ref link="/support/manual/use-cases/" name="Use-cases">
	 <include xml="use-cases/index.xml" prefix="use-cases"></include>
	</ref>
 
</index>
